notation;title;description
1;Lexiko-Grammatik;Die Schülerinnen und Schüler verfügen über ein hinreichend breites Spektrum sprachlicher Mittel, um auch in unvorhersehbaren Situationen zurechtzukommen.;155acc48-3dc2-11ee-ad70-484d7ea9e46c
1.1;sich zu vertrauten Themen (insbesondere solchen des eigenen Interessensbereichs) äußern, mitunter zögernd und mithilfe von Umschreibungen.;;155acc49-3dc2-11ee-b6b7-484d7ea9e46c
1.2;ein breites Spektrum einfacher sprachlicher Mittel flexibel einsetzen, um ihre Mitteilungsabsichten grundlegend zu realisieren, die wichtigsten Aspekte eines Gedankens oder eines Problems zu erklären und eigene Überlegungen zu Themen von allgemeinem Interesse auszudrücken.;;155acc4a-3dc2-11ee-968b-484d7ea9e46c
1.3;ihre Ausdrucksweise auch weniger routinemäßigen, sogar schwierigen Situationen anpassen.;;155acc4b-3dc2-11ee-8f47-484d7ea9e46c
1.4;ein Repertoire von häufig gebrauchten Wendungen, Konstruktionen und Phrasen, die an eher vorhersehbare Situationen gebunden sind, hinreichend korrekt verwenden.;;155acc4c-3dc2-11ee-bbed-484d7ea9e46c
1.5;grammatische Strukturen in vertrauten Kommunikationssituationen hinreichend korrekt und sicher anwenden. Mitunter zeigen sich erkennbare Einflüssen anderer Sprachen, ohne dass dies jedoch das Verständnis beeinträchtigt.;;155acc4d-3dc2-11ee-845f-484d7ea9e46c
1.6;die Orthographie und Zeichensetzung so exakt anwenden, dass die von ihnen produzierten zusammenhängenden Texte verständlich sind.;;155acc4e-3dc2-11ee-af8c-484d7ea9e46c
1.7;ihnen vertraute (digitale) Hilfsmittel situations- und zweckangemessen zur Sicherstellung weitgehender orthographischer Korrektheit in der Regel selbstständig nutzen.;;155acc4f-3dc2-11ee-b879-484d7ea9e46c
2;Aussprache und Prosodie;Die Aussprache der Schülerinnen und Schüler ist im Allgemeinen durchgängig verständlich, auch wenn der Einfluss von anderen Sprachen, die sie sprechen, auf die Betonung, die Intonation und/oder den Rhythmus bemerkbar ist und obwohl sie wiederholt einzelne weniger vertraute Laute und Wörter falsch aussprechen.;155acc50-3dc2-11ee-950c-484d7ea9e46c
