notation;title;description
1;Hypothesen zu Regelmäßigkeiten des Gebrauchs sprachlicher Mittel formulieren.;;15612796-3dc2-11ee-9c17-484d7ea9e46c
2;einige sozial und regional geprägte Varietäten der Fremdsprache wahrnehmen und reflektieren.;;15612797-3dc2-11ee-82a1-484d7ea9e46c
3;Mitteilungsabsichten in vertrauten mündlichen und schriftlichen Kommunikationsformen in der Regel selbständig situations-, adressaten- und zweckangemessen umsetzen.;;15612798-3dc2-11ee-bf65-484d7ea9e46c
4;sprachliche Fehler im Bereich vertrauter morphologisch-syntaktischer und syntaktischer Regelungen in der Regel selbständig erkennen und korrigieren.;;15612799-3dc2-11ee-a8e8-484d7ea9e46c
5;Gemeinsamkeiten, Unterschiede und Beziehungen zwischen Sprachen in der Regel selbständig erkennen und reflektieren.;;1561279a-3dc2-11ee-87b9-484d7ea9e46c
6;über die Erfordernisse einer kommunikativen Situation nachdenken und die so gewonnenen Erkenntnisse in der Regel selbständig in ihrem adressaten-, situations- und zweckangemessenen Sprachhandeln berücksichtigen.;;1561279b-3dc2-11ee-9116-484d7ea9e46c
