notation;title;description
1;Hypothesen zu Regelmäßigkeiten des Gebrauchs sprachlicher Mittel formulieren.;;f798b526-3d9d-11ee-8721-484d7ea9e46c
2;einige sozial und regional geprägte Varietäten der Fremdsprache wahrnehmen und reflektieren.;;f798b527-3d9d-11ee-a2c9-484d7ea9e46c
3;Mitteilungsabsichten in vertrauten mündlichen und schriftlichen Kommunikationsformen in der Regel selbständig situations-, adressaten- und zweckangemessen umsetzen.;;f798b528-3d9d-11ee-8a25-484d7ea9e46c
4;sprachliche Fehler im Bereich vertrauter morphologisch-syntaktischer und syntaktischer Regelungen in der Regel selbständig erkennen und korrigieren.;;f798b529-3d9d-11ee-91d5-484d7ea9e46c
5;Gemeinsamkeiten, Unterschiede und Beziehungen zwischen Sprachen in der Regel selbständig erkennen und reflektieren.;;f798b52a-3d9d-11ee-b3e9-484d7ea9e46c
6;über die Erfordernisse einer kommunikativen Situation nachdenken und die so gewonnenen Erkenntnisse in der Regel selbständig in ihrem adressaten-, situations- und zweckangemessenen Sprachhandeln berücksichtigen.;;f798b52b-3d9d-11ee-a05f-484d7ea9e46c
