notation;title;description
1;über die Erfordernisse einer kommunikativen Situation nachdenken und die so gewonnenen Erkenntnisse in der Regel selbständig in ihrem adressaten-, situations- und zweckangemessenen Sprachhandeln berücksichtigen.;;51d609d4-3dc2-11ee-98d3-484d7ea9e46c
2;ihr Sprachlernverhalten und ihre Sprachlernprozesse (inklusive der genutzten Strategien) in der Regel selbstständig reflektieren und optimieren.;;51d609d5-3dc2-11ee-9829-484d7ea9e46c
3;die ihnen zur Verfügung stehenden sprachlichen Mittel in der Regel selbstständig reflektieren und diese durch den Einsatz von Strategien erweitern und sichern.;;51d609d6-3dc2-11ee-9768-484d7ea9e46c
4;eigene rezeptive, produktive, interaktive und mittelnde Kompetenzen (inkl. des Verfügens über entsprechende sprachliche Mittel) in der Regel selbstständig selbst evaluieren und eigene Lernziele ggf. ändern und neu planen.;;51d609d7-3dc2-11ee-ba21-484d7ea9e46c
5;sind sich ihrer Emotionen und Motivationen beim Fremdsprachenlernen bewusst und können diese in der Regel selbstständig regulieren.;;51d609d8-3dc2-11ee-9139-484d7ea9e46c
6;(digitale) Hilfsmittel zur Optimierung ihrer Sprachlernprozesse in der Regel selbstständig nutzen.;;51d609d9-3dc2-11ee-8b09-484d7ea9e46c
7;die in einer Sprache/anderen Sprachen verfügbaren Kenntnisse und Erfahrungen aus dem Erlernen anderer Sprachen zur Optimierung ihrer Sprachlernprozesse in der Regel selbstständig nutzen.;;51d609da-3dc2-11ee-8c0a-484d7ea9e46c
