notation;title;description
1;über die Erfordernisse einer kommunikativen Situation nachdenken und die so gewonnenen Erkenntnisse in der Regel selbständig in ihrem adressaten-, situations- und zweckangemessenen Sprachhandeln berücksichtigen.;;f79b8bea-3d9d-11ee-a09c-484d7ea9e46c
2;ihr Sprachlernverhalten und ihre Sprachlernprozesse (inklusive der genutzten Strategien) in der Regel selbstständig reflektieren und optimieren.;;f79b8beb-3d9d-11ee-a317-484d7ea9e46c
3;die ihnen zur Verfügung stehenden sprachlichen Mittel in der Regel selbstständig reflektieren und diese durch den Einsatz von Strategien erweitern und sichern.;;f79b8bec-3d9d-11ee-bc94-484d7ea9e46c
4;eigene rezeptive, produktive, interaktive und mittelnde Kompetenzen (inkl. des Verfügens über entsprechende sprachliche Mittel) in der Regel selbstständig selbst evaluieren und eigene Lernziele ggf. ändern und neu planen.;;f79b8bed-3d9d-11ee-9e01-484d7ea9e46c
5;sind sich ihrer Emotionen und Motivationen beim Fremdsprachenlernen bewusst und können diese in der Regel selbstständig regulieren.;;f79b8bee-3d9d-11ee-af69-484d7ea9e46c
6;(digitale) Hilfsmittel zur Optimierung ihrer Sprachlernprozesse in der Regel selbstständig nutzen.;;f79b8bef-3d9d-11ee-84c4-484d7ea9e46c
7;die in einer Sprache/anderen Sprachen verfügbaren Kenntnisse und Erfahrungen aus dem Erlernen anderer Sprachen zur Optimierung ihrer Sprachlernprozesse in der Regel selbstständig nutzen.;;f79b8bf0-3d9d-11ee-9cff-484d7ea9e46c
