notation;title;description
1;Lexiko-Grammatik;Die sprachlichen Mittel – Wortschatz, Grammatik, Aussprache, Prosodie und Orthographie – sind Kompetenz bildende, funktionale Bestandteile des sprachlichen Systems und der Kommunikation. In der Vermittlung und bei der Aneignung der funktionalen kommunikativen Kompetenz haben die sprachlichen Mittel allerdings grundsätzlich dienende Funktion, da die gelingende Kommunikation im Vordergrund steht. Die kommunikativen Ziele können – u.a. abhängig vom erreichten Kompetenzniveau und der Kooperationsbereitschaft der Kommunikationspartnerinnen und -partner – mit unterschiedlichen sprachlichen Mitteln erreicht werden. Bei der Auswahl der zu vermittelnden sprachlichen Mittel sollte daher von einer kommunikativen Progression ausgegangen werden, während die sprachstrukturelle Progression eine nachgeordnete, dienende Funktion hat. Die Vermittlung und die Aneignung von Wortschatz im Sinne komplexer lexiko-grammatischer Einheiten sind mit Blick auf die funktionale kommunikative Kompetenz zentral.;51e53866-3dc2-11ee-ac04-484d7ea9e46c
1.1;sich zu vertrauten Themen (insbesondere solchen des eigenen Interessensbereichs) äußern, mitunter zögernd und mithilfe von Umschreibungen.;;51e53867-3dc2-11ee-9367-484d7ea9e46c
1.2;ein breites Spektrum einfacher sprachlicher Mittel flexibel einsetzen, um ihre Mitteilungsabsichten grundlegend zu realisieren, die wichtigsten Aspekte eines Gedankens oder eines Problems zu erklären und eigene Überlegungen zu Themen von allgemeinem Interesse auszudrücken.;;51e53868-3dc2-11ee-9f97-484d7ea9e46c
1.3;ihre Ausdrucksweise auch weniger routinemäßigen, sogar schwierigen Situationen anpassen.;;51e53869-3dc2-11ee-9d8b-484d7ea9e46c
1.4;ein Repertoire von häufig gebrauchten Wendungen, Konstruktionen und Phrasen, die an eher vorhersehbare Situationen gebunden sind, hinreichend korrekt verwenden.;;51e5386a-3dc2-11ee-9163-484d7ea9e46c
1.5;grammatische Strukturen in vertrauten Kommunikationssituationen hinreichend korrekt und sicher anwenden. Mitunter zeigen sich erkennbare Einflüssen anderer Sprachen, ohne dass dies jedoch das Verständnis beeinträchtigt.;;51e5386b-3dc2-11ee-b4fe-484d7ea9e46c
1.6;die Orthographie und Zeichensetzung so exakt anwenden, dass die von ihnen produzierten zusammenhängenden Texte verständlich sind.;;51e5386c-3dc2-11ee-a4ec-484d7ea9e46c
1.7;ihnen vertraute (digitale) Hilfsmittel situations- und zweckangemessen zur Sicherstellung weitgehender orthographischer Korrektheit in der Regel selbstständig nutzen.;;51e5386d-3dc2-11ee-bdd8-484d7ea9e46c
2;Aussprache und Prosodie;Die Aussprache der Schülerinnen und Schüler ist im Allgemeinen durchgängig verständlich, auch wenn der Einfluss von anderen Sprachen, die sie sprechen, auf die Betonung, die Intonation und/oder den Rhythmus bemerkbar ist und obwohl sie wiederholt einzelne weniger vertraute Laute und Wörter falsch aussprechen.;51e5386e-3dc2-11ee-b14d-484d7ea9e46c
