notation;title;description
1;Hypothesen zu Regelmäßigkeiten des Gebrauchs sprachlicher Mittel formulieren.;;2a3e14d9-0a34-45e6-8776-1ff940ae5a7d
2;einige sozial und regional geprägte Varietäten der Fremdsprache wahrnehmen und reflektieren.;;080fa762-0ffc-44df-baa5-0cd98ee3fdcf
3;Mitteilungsabsichten in vertrauten mündlichen und schriftlichen Kommunikationsformen in der Regel selbständig situations-, adressaten- und zweckangemessen umsetzen.;;d9bc1570-7056-486c-a2dc-5f878aa825dc
4;sprachliche Fehler im Bereich vertrauter morphologisch-syntaktischer und syntaktischer Regelungen in der Regel selbständig erkennen und korrigieren.;;4667b31c-98d1-49ff-bd9f-613b54c45f4a
5;Gemeinsamkeiten, Unterschiede und Beziehungen zwischen Sprachen in der Regel selbständig erkennen und reflektieren.;;2b263ba3-16ea-4974-a890-406f2944e338
6;über die Erfordernisse einer kommunikativen Situation nachdenken und die so gewonnenen Erkenntnisse in der Regel selbständig in ihrem adressaten-, situations- und zweckangemessenen Sprachhandeln berücksichtigen.;;de2b263c-5a0e-4cd5-a95b-31809d88ec05
