notation;title;description
1;sich der Vielfalt der Sitten und Gebräuche, der Einstellungen, Werte und Überzeugungen verschiedener gesellschaftlicher (einschließlich der eigenen) Gruppen bewusst, können auf entsprechende Signale achten sowie entsprechend wertebezogen und kommunikativ handeln.;;02043f66-4d50-4d00-8248-42591139f074
2;sich in interkulturellen Situationen der Ähnlichkeiten und Unterschiede von Konventionen (z.B. in Bezug auf Körperhaltung, Blickkontakt und Abstand zu anderen) bewusst und können angemessen damit umgehen.;;0c62cd4c-984b-42f8-a1a1-b43d43050999
3;in interkulturellen Situationen im Rahmen der ihnen zur Verfügung stehenden Mittel mit dem Kommunikationspartner sprachlich angemessen in Bezug auf Situation und Beteiligte agieren.;;3ab4da4c-766d-44c2-a5f9-9f36f3f52282
4;einen interkulturellen Austausch unterstützen, indem sie Offenheit, Interesse und Empathie durch Fragen und die Reaktion auf Fragen zeigen. Dabei sind sie sich der Tatsache bewusst, dass manche Themen und Fragen in den betroffenen Kulturen unterschiedlich wahrgenommen werden können.;;fdf5da3f-e4db-44a9-b138-d3090c994bc6
5;(als kulturelle Mittler) die Parteien bei einer Meinungsverschiedenheit bitten, ihr Problem zu erläutern, und kurz darauf reagieren, vorausgesetzt es handelt sich um ein vertrautes Thema und die Beteiligten drücken sich deutlich aus.;;85e805d3-a4ee-46fa-9b52-1beb6b45915a
6;in einfachen Begriffen diskutieren, wie die kulturell bedingten Handlungen verschiedener gesellschaftlicher (einschließlich der eigenen) Gruppen unterschiedlich wahrgenommen werden können.;;a0ce0bb2-2a2c-4ced-b041-b95c683bf25e
7;die in einer Sprache/in anderen Sprachen verfügbaren Kenntnisse, Fertigkeiten und erlernten Strategien für Sprachhandlungen in interkulturellen (Alltags-) Situationen in der Regel selbstständig nutzen.;;81c24904-8791-4f5e-b459-28a00b4a9ab1
8;ihre zur Verfügung stehende interkulturelle Bewusstheit in Alltagskontexten in der Regel selbstständig reflektieren, um mit einer unerwarteten Situation adressaten-, situations- und zweckangemessen umgehen zu können.;;adc271b1-c7fd-4835-b2c5-d8e482440d45
