notation;title;description
1;Hypothesen zu Regelmäßigkeiten des Gebrauchs sprachlicher Mittel formulieren.;;c2f44e82-0d9f-4304-b36d-da2df55e4f22
2;einige sozial und regional geprägte Varietäten der Fremdsprache wahrnehmen und reflektieren.;;5ca642d1-cea0-4230-a76e-ceede50d0519
3;Mitteilungsabsichten in vertrauten mündlichen und schriftlichen Kommunikationsformen in der Regel selbständig situations-, adressaten- und zweckangemessen umsetzen.;;47bbaeb2-a2b9-4f9f-8612-f79d08c66032
4;sprachliche Fehler im Bereich vertrauter morphologisch-syntaktischer und syntaktischer Regelungen in der Regel selbständig erkennen und korrigieren.;;cbc03656-18b0-4618-9906-89686d95fb51
5;Gemeinsamkeiten, Unterschiede und Beziehungen zwischen Sprachen in der Regel selbständig erkennen und reflektieren.;;4e19bb7d-d701-4bc2-a883-5eb0bc80711c
6;über die Erfordernisse einer kommunikativen Situation nachdenken und die so gewonnenen Erkenntnisse in der Regel selbständig in ihrem adressaten-, situations- und zweckangemessenen Sprachhandeln berücksichtigen.;;a601c252-8d98-4616-934d-ced6f17fee0b
