notation;title;description
1;über die Erfordernisse einer kommunikativen Situation nachdenken und die so gewonnenen Erkenntnisse in der Regel selbständig in ihrem adressaten-, situations- und zweckangemessenen Sprachhandeln berücksichtigen.;;dd95dd97-1f41-48f0-90fd-a5c7c04ee0ce
2;ihr Sprachlernverhalten und ihre Sprachlernprozesse (inklusive der genutzten Strategien) in der Regel selbstständig reflektieren und optimieren.;;1f8c4bf2-a2d9-4629-b071-0999260d9480
3;die ihnen zur Verfügung stehenden sprachlichen Mittel in der Regel selbstständig reflektieren und diese durch den Einsatz von Strategien erweitern und sichern.;;2f34d049-177a-436f-9008-d0299ef56d7a
4;eigene rezeptive, produktive, interaktive und mittelnde Kompetenzen (inkl. des Verfügens über entsprechende sprachliche Mittel) in der Regel selbstständig selbst evaluieren und eigene Lernziele ggf. ändern und neu planen.;;e406ff4c-8566-4b13-85ea-bedd00fedbe7
5;sind sich ihrer Emotionen und Motivationen beim Fremdsprachenlernen bewusst und können diese in der Regel selbstständig regulieren.;;96f9b737-34be-46ba-a35a-b948488a6eb9
6;(digitale) Hilfsmittel zur Optimierung ihrer Sprachlernprozesse in der Regel selbstständig nutzen.;;b6fbfd76-95a7-48c6-99d9-04250fa4e35d
7;die in einer Sprache/anderen Sprachen verfügbaren Kenntnisse und Erfahrungen aus dem Erlernen anderer Sprachen zur Optimierung ihrer Sprachlernprozesse in der Regel selbstständig nutzen.;;dceacf2d-c369-44dc-a734-3f92358da893
