notation;title;description
1;apparier des informations;;56b8f63f-b5cc-4422-bff7-8085e8de84c8
2;comprendre des indications de direction/consigne;;4f9a4622-6b09-481c-9b83-91ebd7644dbb
3;comprendre les messages principeaux;;4291e2d2-89f5-4e3e-b0a8-a35bb033ff79
4;comprendre l'idée generale;;849b7a0a-bc70-440f-ad1c-893772003348
5;déduire le sens d'un mot ou d'un group lexical;;e2aeded8-97a5-40db-8038-aa1aaa2d7b5a
6;faire des inférences simples;;daf2f091-1e50-4c1f-bc27-2c340f822966
7;identifier une information spécifique;;b86dcac7-81d4-4c66-90cc-6890c886c974
